{
  "packet_version": 1,
  "packet_id": "P12",
  "repository": "redpanda-data/benthos",
  "incident_date": "2024-12-03",
  "control_kind": "lint/type checks",
  "sources": [
    {
      "id": "E1",
      "url": "https://github.com/redpanda-data/benthos/issues/150",
      "kind": "issue",
      "evidence_excerpt": "Version 4.42 lint commands with no input returned zero; the sibling test command failed closed."
    }
  ],
  "intended_control": "Lint configuration or template files and fail when the invocation names no files to inspect.",
  "false_acceptance": "Both lint entry points returned success with no inputs, allowing a mistyped invocation to certify an empty set.",
  "causal_chain": [
    {
      "status": "FACT",
      "claim": "The help text presents linting as a file-checking command whose status reports detected errors.",
      "evidence": ["E1"]
    },
    {
      "status": "FACT",
      "claim": "Calling lint or template lint with no file arguments returned zero.",
      "evidence": ["E1"]
    },
    {
      "status": "FACT",
      "claim": "The sibling test command reported no tests and returned one, demonstrating an available fail-closed convention.",
      "evidence": ["E1"]
    },
    {
      "status": "DERIVATION",
      "claim": "The lint success signal does not distinguish an empty invocation from a non-empty clean run.",
      "evidence": ["E1"]
    }
  ],
  "reproducer": {
    "availability": "executable",
    "steps": [
      "Run the redpandadata/connect:4.42 container with template lint and no file argument.",
      "Repeat with lint and no file argument.",
      "Compare both statuses with the test command when no tests are found."
    ],
    "observed": "Both lint commands returned zero without inspecting a file; the no-tests command returned one.",
    "expected": "A lint invocation with no files should diagnose the empty scope and return non-zero."
  },
  "epistemic": {
    "facts": [
      "The issue includes versioned container commands, help text, and exit statuses."
    ],
    "derivations": [
      "The examples make a missing positional argument easy to confuse with a legitimate empty invocation."
    ],
    "unknowns": [
      "No maintainer response or fixing change defines whether zero-input lint was intentionally supported."
    ]
  },
  "researcher_assessment": {
    "mechanisms": ["VACUOUS_ACCEPTANCE", "STATEMENT_WEAKENED"],
    "primary": "VACUOUS_ACCEPTANCE",
    "scope_controlled_by_audited_artifact": "no",
    "counterclassification": {
      "label": "OUT_OF_SCOPE",
      "would_be_primary_if": "Zero-input lint is explicitly documented as a valid no-op whose success makes no claim that files were checked."
    },
    "expected_multilabel": true
  },
  "evidence_confidence": "VERIFIED"
}
