{
  "packet_version": 1,
  "packet_id": "P07",
  "repository": "bats-core/bats-core",
  "incident_date": "2026-04-04..2026-07-18",
  "control_kind": "tests",
  "sources": [
    {
      "id": "E1",
      "url": "https://github.com/bats-core/bats-core/issues/1199",
      "kind": "issue",
      "evidence_excerpt": "bats with an empty first argument collected zero, exited zero, and masked a nixpkgs test change."
    },
    {
      "id": "E2",
      "url": "https://github.com/bats-core/bats-core/commit/2c6cde7bdeaaea8ba597d359f11acffc688a7ed3",
      "kind": "commit",
      "evidence_excerpt": "The merged change makes empty suites exit one and adds explicit empty-file and empty-directory tests."
    }
  ],
  "intended_control": "Execute the Bats suite named by a caller-supplied path and fail if no requested tests are present.",
  "false_acceptance": "An empty expanded path collected zero tests and returned success, so the surrounding nixpkgs tests appeared to pass.",
  "causal_chain": [
    {
      "status": "FACT",
      "claim": "Invoking bats with an empty string collected zero tests and exited zero in version 1.12.0.",
      "evidence": ["E1"]
    },
    {
      "status": "FACT",
      "claim": "The reporter encountered this after a nixpkgs variable began expanding to an empty string while tests remained green.",
      "evidence": ["E1"]
    },
    {
      "status": "FACT",
      "claim": "The merged fix changes empty-suite status to one unless explicitly allowed.",
      "evidence": ["E2"]
    }
  ],
  "reproducer": {
    "availability": "executable",
    "steps": [
      "Install Bats 1.12.0.",
      "Invoke bats with one empty-string argument.",
      "Observe test count and process status."
    ],
    "observed": "Zero tests were collected and the process exited zero.",
    "expected": "An empty suite should exit non-zero unless the caller opts into allowing it."
  },
  "epistemic": {
    "facts": [
      "The issue gives a one-command reproducer and a concrete masked upstream change.",
      "The fix is merged with tests for empty files and directories."
    ],
    "derivations": [
      "The governing false success is produced inside the runner's empty-suite semantics."
    ],
    "unknowns": [
      "The upstream nixpkgs revision affected by the masked variable change is not linked."
    ]
  },
  "researcher_assessment": {
    "mechanisms": ["VACUOUS_ACCEPTANCE"],
    "primary": "VACUOUS_ACCEPTANCE",
    "scope_controlled_by_audited_artifact": "no",
    "counterclassification": {
      "label": "HARNESS_ORCHESTRATION_DEFECT",
      "would_be_primary_if": "Bats had returned non-zero and a calling wrapper had replaced that status with success."
    },
    "expected_multilabel": false
  },
  "evidence_confidence": "VERIFIED"
}
