{
  "packet_version": 1,
  "packet_id": "P02",
  "repository": "microsoft/vstest",
  "incident_date": "2019-12-04..2020-11-03",
  "control_kind": "tests",
  "sources": [
    {
      "id": "E1",
      "url": "https://github.com/microsoft/vstest/issues/2262",
      "kind": "issue",
      "evidence_excerpt": "Selecting a nonexistent test method discovered one test, matched none, and exited zero."
    },
    {
      "id": "E2",
      "url": "https://github.com/microsoft/vstest/commit/fda96e02a55d9afe4ff945314dca3aade3917a1b",
      "kind": "commit",
      "evidence_excerpt": "The merged change introduced TreatNoTestsAsError for non-zero status when no tests are available."
    }
  ],
  "intended_control": "Execute an explicitly selected .NET test and expose success or failure through process status.",
  "false_acceptance": "A selection matching no test returned process status zero, indistinguishable to a status-only CI gate from a passing run.",
  "causal_chain": [
    {
      "status": "FACT",
      "claim": "The issue reproduces the behavior with a nonexistent test method.",
      "evidence": ["E1"]
    },
    {
      "status": "FACT",
      "claim": "The runner reported that no test matched and returned zero.",
      "evidence": ["E1"]
    },
    {
      "status": "FACT",
      "claim": "The merged remedy added an explicit option to make no tests an error.",
      "evidence": ["E2"]
    }
  ],
  "reproducer": {
    "availability": "documented",
    "steps": [
      "Build the issue's one-test .NET Framework project.",
      "Invoke vstest.console.exe with /tests naming TestMethod2, which does not exist.",
      "Observe the selection diagnostic and process status."
    ],
    "observed": "No test matched the selection criteria; process status was zero.",
    "expected": "A non-zero status when the explicit selection executes no tests."
  },
  "epistemic": {
    "facts": [
      "The report supplies two reproduction routes and full console output.",
      "The linked implementation was merged."
    ],
    "derivations": [
      "A status-only external gate cannot distinguish this empty run from a successful non-empty run without the new option."
    ],
    "unknowns": [
      "The report does not identify a particular production merge accepted because of this behavior."
    ]
  },
  "researcher_assessment": {
    "mechanisms": ["VACUOUS_ACCEPTANCE"],
    "primary": "VACUOUS_ACCEPTANCE",
    "scope_controlled_by_audited_artifact": "no",
    "counterclassification": {
      "label": "HARNESS_ORCHESTRATION_DEFECT",
      "would_be_primary_if": "A distinct wrapper had received a non-zero runner result and suppressed or reversed it."
    },
    "expected_multilabel": false
  },
  "evidence_confidence": "VERIFIED"
}
