{
  "packet_version": 1,
  "packet_id": "P08",
  "repository": "lfn-cnti/testsuite",
  "incident_date": "2026-08-11..2026-08-21",
  "control_kind": "tests",
  "sources": [
    {
      "id": "E1",
      "url": "https://github.com/lfn-cnti/testsuite/issues/2411",
      "kind": "issue",
      "evidence_excerpt": "Failing runs exited zero because no points entry activated the required-task failure path."
    },
    {
      "id": "E2",
      "url": "https://github.com/lfn-cnti/testsuite/pull/2424",
      "kind": "pull_request",
      "evidence_excerpt": "The merged fix derives exit status from outcomes and adds points specifications for both verdict directions."
    }
  ],
  "intended_control": "Run the conformance test suite and expose whether its objective was met through the process exit status.",
  "false_acceptance": "Runs containing failed tests returned zero because the only failure-status path depended on an unused required flag.",
  "causal_chain": [
    {
      "status": "FACT",
      "claim": "Exit code one was written only when failed_required_tasks was non-empty.",
      "evidence": ["E1"]
    },
    {
      "status": "FACT",
      "claim": "No entry in the embedded points configuration set required, making that path unreachable for ordinary failures.",
      "evidence": ["E1"]
    },
    {
      "status": "FACT",
      "claim": "The merged fix derives status from recorded outcomes or the run's explicit pass criterion.",
      "evidence": ["E2"]
    },
    {
      "status": "DERIVATION",
      "claim": "A CI system relying on process status received a false success despite the test suite recording failures.",
      "evidence": ["E1", "E2"]
    }
  ],
  "reproducer": {
    "availability": "documented",
    "steps": [
      "Use the pre-fix suite revision with a target that produces at least one failed but no errored test.",
      "Run a non-strict all, workload, or platform task group.",
      "Compare the recorded failed count with process status."
    ],
    "observed": "The results recorded failures while the process exited zero.",
    "expected": "A non-strict completed run with failures should exit one."
  },
  "epistemic": {
    "facts": [
      "The issue pins the dead configuration path to named source locations.",
      "The fixing pull request was merged and reports focused specification coverage."
    ],
    "derivations": [
      "The defect lies between recorded test outcomes and the governing process-status gate."
    ],
    "unknowns": [
      "The packet does not include an archived CI run that accepted a specific nonconformant target."
    ]
  },
  "researcher_assessment": {
    "mechanisms": ["HARNESS_ORCHESTRATION_DEFECT"],
    "primary": "HARNESS_ORCHESTRATION_DEFECT",
    "scope_controlled_by_audited_artifact": "no",
    "counterclassification": {
      "label": "STATEMENT_WEAKENED",
      "would_be_primary_if": "The documented exit-code statement intentionally defined success independently of failed test outcomes."
    },
    "expected_multilabel": false
  },
  "evidence_confidence": "VERIFIED"
}
